<?xml version="1.0" encoding="UTF-8"?>

<ed:reserva 
	xmlns:xsi="http://www.w3.org/2001/XMLSchema-instance" 
	xmlns:ed="http://www.eDreams.es/"
	xmlns:s = "http://www.eDreams.es/elementosSimples" 
	xsi:schemaLocation = "http://www.eDreams.es/ eDreams.xsd">

	<vuelo id = "203">
		<tipo>Ida y Vuelta</tipo>
		<trayecto>
			<origen WAC="PMI"> Palma de Mallorca </origen>
			<destino WAC="BER"> Berl√≠n </destino>
		</trayecto>
		<fecha>
			<salida>
				<dia> 26 </dia>
				<mes> 02 </mes>
				<ano> 2016 </ano>
			</salida>
			<regreso>
				<dia> 10 </dia>
				<mes> 03 </mes>
				<ano> 2016 </ano>
			</regreso>
		</fecha>
		<pasajero>
			<adulto> 2 </adulto>
			<jubilados>1</jubilados>
			<estudiantes>1</estudiantes>
			<infante> 2 </infante>
			<bebe> 0 </bebe>
		</pasajero>
		<clase>
			<turista> 1 </turista>
			<turistaSuperior> 0 </turistaSuperior>
			<business> 2 </business>
			<primera> 0 </primera>
		</clase>
	</vuelo>
</ed:reserva>